{
  "meta": {
    "name": "Demo 4-story steel frame (synthetic)",
    "source": "synthetic",
    "units": {
      "length": "m",
      "force": "kN",
      "pressure": "kPa"
    },
    "material": "steel"
  },
  "grids": {
    "x": [
      {
        "name": "1",
        "coord": 0.0
      },
      {
        "name": "2",
        "coord": 8.0
      },
      {
        "name": "3",
        "coord": 16.0
      },
      {
        "name": "4",
        "coord": 24.0
      },
      {
        "name": "5",
        "coord": 32.0
      },
      {
        "name": "6",
        "coord": 36.0
      }
    ],
    "y": [
      {
        "name": "A",
        "coord": 0.0
      },
      {
        "name": "B",
        "coord": 7.0
      },
      {
        "name": "C",
        "coord": 14.0
      },
      {
        "name": "D",
        "coord": 21.0
      }
    ]
  },
  "levels": [
    {
      "name": "Base",
      "z": 0.0
    },
    {
      "name": "L1",
      "z": 4.0
    },
    {
      "name": "L2",
      "z": 7.6
    },
    {
      "name": "L3",
      "z": 11.2
    },
    {
      "name": "ROOF",
      "z": 14.8
    }
  ],
  "stories": [
    {
      "name": "Story1",
      "bottom_level": "Base",
      "top_level": "L1",
      "bottom_z": 0.0,
      "top_z": 4.0,
      "below_grade": false,
      "occupied": true
    },
    {
      "name": "Story2",
      "bottom_level": "L1",
      "top_level": "L2",
      "bottom_z": 4.0,
      "top_z": 7.6,
      "below_grade": false,
      "occupied": true
    },
    {
      "name": "Story3",
      "bottom_level": "L2",
      "top_level": "L3",
      "bottom_z": 7.6,
      "top_z": 11.2,
      "below_grade": false,
      "occupied": true
    },
    {
      "name": "Story4",
      "bottom_level": "L3",
      "top_level": "ROOF",
      "bottom_z": 11.2,
      "top_z": 14.8,
      "below_grade": false,
      "occupied": true
    }
  ],
  "outlines": {
    "L1": [
      [
        0.0,
        0.0
      ],
      [
        36.0,
        0.0
      ],
      [
        36.0,
        21.0
      ],
      [
        0.0,
        21.0
      ]
    ],
    "L2": [
      [
        0.0,
        0.0
      ],
      [
        36.0,
        0.0
      ],
      [
        36.0,
        21.0
      ],
      [
        0.0,
        21.0
      ]
    ],
    "L3": [
      [
        0.0,
        0.0
      ],
      [
        36.0,
        0.0
      ],
      [
        36.0,
        21.0
      ],
      [
        0.0,
        21.0
      ]
    ],
    "ROOF": [
      [
        0.0,
        0.0
      ],
      [
        36.0,
        0.0
      ],
      [
        36.0,
        21.0
      ],
      [
        0.0,
        21.0
      ]
    ]
  },
  "sections": {
    "W14X90": {
      "shape": "W",
      "d_m": 0.356,
      "mass_kg_per_m": 134.0
    },
    "W14X61": {
      "shape": "W",
      "d_m": 0.353,
      "mass_kg_per_m": 90.8
    },
    "W21X44": {
      "shape": "W",
      "d_m": 0.525,
      "mass_kg_per_m": 65.5
    },
    "W18X35": {
      "shape": "W",
      "d_m": 0.45,
      "mass_kg_per_m": 52.1
    }
  },
  "columns": [
    {
      "id": "C_A1_S1",
      "location_id": "A1",
      "x": 0.0,
      "y": 0.0,
      "story": "Story1",
      "bottom_z": 0.0,
      "top_z": 4.0,
      "section": "W14X90",
      "splice_at_bottom": false
    },
    {
      "id": "C_B1_S1",
      "location_id": "B1",
      "x": 0.0,
      "y": 7.0,
      "story": "Story1",
      "bottom_z": 0.0,
      "top_z": 4.0,
      "section": "W14X90",
      "splice_at_bottom": false
    },
    {
      "id": "C_C1_S1",
      "location_id": "C1",
      "x": 0.0,
      "y": 14.0,
      "story": "Story1",
      "bottom_z": 0.0,
      "top_z": 4.0,
      "section": "W14X90",
      "splice_at_bottom": false
    },
    {
      "id": "C_D1_S1",
      "location_id": "D1",
      "x": 0.0,
      "y": 21.0,
      "story": "Story1",
      "bottom_z": 0.0,
      "top_z": 4.0,
      "section": "W14X90",
      "splice_at_bottom": false
    },
    {
      "id": "C_A2_S1",
      "location_id": "A2",
      "x": 8.0,
      "y": 0.0,
      "story": "Story1",
      "bottom_z": 0.0,
      "top_z": 4.0,
      "section": "W14X90",
      "splice_at_bottom": false
    },
    {
      "id": "C_B2_S1",
      "location_id": "B2",
      "x": 8.0,
      "y": 7.0,
      "story": "Story1",
      "bottom_z": 0.0,
      "top_z": 4.0,
      "section": "W14X90",
      "splice_at_bottom": false
    },
    {
      "id": "C_C2_S1",
      "location_id": "C2",
      "x": 8.0,
      "y": 14.0,
      "story": "Story1",
      "bottom_z": 0.0,
      "top_z": 4.0,
      "section": "W14X90",
      "splice_at_bottom": false
    },
    {
      "id": "C_D2_S1",
      "location_id": "D2",
      "x": 8.0,
      "y": 21.0,
      "story": "Story1",
      "bottom_z": 0.0,
      "top_z": 4.0,
      "section": "W14X90",
      "splice_at_bottom": false
    },
    {
      "id": "C_A3_S1",
      "location_id": "A3",
      "x": 16.0,
      "y": 0.0,
      "story": "Story1",
      "bottom_z": 0.0,
      "top_z": 4.0,
      "section": "W14X90",
      "splice_at_bottom": false
    },
    {
      "id": "C_B3_S1",
      "location_id": "B3",
      "x": 16.0,
      "y": 7.0,
      "story": "Story1",
      "bottom_z": 0.0,
      "top_z": 4.0,
      "section": "W14X90",
      "splice_at_bottom": false
    },
    {
      "id": "C_C3_S1",
      "location_id": "C3",
      "x": 16.0,
      "y": 14.0,
      "story": "Story1",
      "bottom_z": 0.0,
      "top_z": 4.0,
      "section": "W14X90",
      "splice_at_bottom": false
    },
    {
      "id": "C_D3_S1",
      "location_id": "D3",
      "x": 16.0,
      "y": 21.0,
      "story": "Story1",
      "bottom_z": 0.0,
      "top_z": 4.0,
      "section": "W14X90",
      "splice_at_bottom": false
    },
    {
      "id": "C_A4_S1",
      "location_id": "A4",
      "x": 24.0,
      "y": 0.0,
      "story": "Story1",
      "bottom_z": 0.0,
      "top_z": 4.0,
      "section": "W14X90",
      "splice_at_bottom": false
    },
    {
      "id": "C_B4_S1",
      "location_id": "B4",
      "x": 24.0,
      "y": 7.0,
      "story": "Story1",
      "bottom_z": 0.0,
      "top_z": 4.0,
      "section": "W14X90",
      "splice_at_bottom": false
    },
    {
      "id": "C_C4_S1",
      "location_id": "C4",
      "x": 24.0,
      "y": 14.0,
      "story": "Story1",
      "bottom_z": 0.0,
      "top_z": 4.0,
      "section": "W14X90",
      "splice_at_bottom": false
    },
    {
      "id": "C_D4_S1",
      "location_id": "D4",
      "x": 24.0,
      "y": 21.0,
      "story": "Story1",
      "bottom_z": 0.0,
      "top_z": 4.0,
      "section": "W14X90",
      "splice_at_bottom": false
    },
    {
      "id": "C_A5_S1",
      "location_id": "A5",
      "x": 32.0,
      "y": 0.0,
      "story": "Story1",
      "bottom_z": 0.0,
      "top_z": 4.0,
      "section": "W14X90",
      "splice_at_bottom": false
    },
    {
      "id": "C_B5_S1",
      "location_id": "B5",
      "x": 32.0,
      "y": 7.0,
      "story": "Story1",
      "bottom_z": 0.0,
      "top_z": 4.0,
      "section": "W14X90",
      "splice_at_bottom": false
    },
    {
      "id": "C_C5_S1",
      "location_id": "C5",
      "x": 32.0,
      "y": 14.0,
      "story": "Story1",
      "bottom_z": 0.0,
      "top_z": 4.0,
      "section": "W14X90",
      "splice_at_bottom": false
    },
    {
      "id": "C_D5_S1",
      "location_id": "D5",
      "x": 32.0,
      "y": 21.0,
      "story": "Story1",
      "bottom_z": 0.0,
      "top_z": 4.0,
      "section": "W14X90",
      "splice_at_bottom": false
    },
    {
      "id": "C_A6_S1",
      "location_id": "A6",
      "x": 36.0,
      "y": 0.0,
      "story": "Story1",
      "bottom_z": 0.0,
      "top_z": 4.0,
      "section": "W14X90",
      "splice_at_bottom": false
    },
    {
      "id": "C_B6_S1",
      "location_id": "B6",
      "x": 36.0,
      "y": 7.0,
      "story": "Story1",
      "bottom_z": 0.0,
      "top_z": 4.0,
      "section": "W14X90",
      "splice_at_bottom": false
    },
    {
      "id": "C_C6_S1",
      "location_id": "C6",
      "x": 36.0,
      "y": 14.0,
      "story": "Story1",
      "bottom_z": 0.0,
      "top_z": 4.0,
      "section": "W14X90",
      "splice_at_bottom": false
    },
    {
      "id": "C_D6_S1",
      "location_id": "D6",
      "x": 36.0,
      "y": 21.0,
      "story": "Story1",
      "bottom_z": 0.0,
      "top_z": 4.0,
      "section": "W14X90",
      "splice_at_bottom": false
    },
    {
      "id": "C_A1_S2",
      "location_id": "A1",
      "x": 0.0,
      "y": 0.0,
      "story": "Story2",
      "bottom_z": 4.0,
      "top_z": 7.6,
      "section": "W14X90",
      "splice_at_bottom": false
    },
    {
      "id": "C_B1_S2",
      "location_id": "B1",
      "x": 0.0,
      "y": 7.0,
      "story": "Story2",
      "bottom_z": 4.0,
      "top_z": 7.6,
      "section": "W14X90",
      "splice_at_bottom": false
    },
    {
      "id": "C_C1_S2",
      "location_id": "C1",
      "x": 0.0,
      "y": 14.0,
      "story": "Story2",
      "bottom_z": 4.0,
      "top_z": 7.6,
      "section": "W14X90",
      "splice_at_bottom": false
    },
    {
      "id": "C_D1_S2",
      "location_id": "D1",
      "x": 0.0,
      "y": 21.0,
      "story": "Story2",
      "bottom_z": 4.0,
      "top_z": 7.6,
      "section": "W14X90",
      "splice_at_bottom": false
    },
    {
      "id": "C_A2_S2",
      "location_id": "A2",
      "x": 8.0,
      "y": 0.0,
      "story": "Story2",
      "bottom_z": 4.0,
      "top_z": 7.6,
      "section": "W14X90",
      "splice_at_bottom": false
    },
    {
      "id": "C_B2_S2",
      "location_id": "B2",
      "x": 8.0,
      "y": 7.0,
      "story": "Story2",
      "bottom_z": 4.0,
      "top_z": 7.6,
      "section": "W14X90",
      "splice_at_bottom": false
    },
    {
      "id": "C_C2_S2",
      "location_id": "C2",
      "x": 8.0,
      "y": 14.0,
      "story": "Story2",
      "bottom_z": 4.0,
      "top_z": 7.6,
      "section": "W14X90",
      "splice_at_bottom": false
    },
    {